{
  "contract_type": "checkpoint_to_memory_contract",
  "contract_id": "aoa-memo.runtime-writeback.v1",
  "source_seed_ref": "repo:Dionysus/seed_expansion/seed.aoa.agents-runtime-pack.v0.md#aoa-seed-r3-runtime-writeback-to-memo",
  "checkpoint_artifact": {
    "artifact_name": "inquiry_checkpoint",
    "schema_ref": "mechanics/recurrence-support/schemas/inquiry_checkpoint.schema.json",
    "posture": "route_artifact_not_memory_object"
  },
  "runtime_boundary": {
    "scratchpad_posture": "runtime_local_only",
    "checkpoint_export_kind": "state_capsule",
    "distillation_review_posture": "review_required",
    "review_boundary_refs": [
      "mechanics/writeback/docs/WRITEBACK_TEMPERATURE_POLICY.md#writeback-classes",
      "docs/MEMORY_MODEL.md#checkpoint-route-writeback",
      "repo:aoa-agents/docs/AGENT_MEMORY_POSTURE.md"
    ]
  },
  "mapping_rules": [
    {
      "runtime_surface": "checkpoint_export",
      "runtime_refs": [
        "mechanics/recurrence-support/schemas/inquiry_checkpoint.schema.json",
        "mechanics/writeback/docs/WRITEBACK_TEMPERATURE_POLICY.md#inquiry-checkpoint-packs"
      ],
      "target_kind": "state_capsule",
      "writeback_class": "checkpoint_export",
      "temperature_hint": "hot",
      "review_state_default": "captured",
      "requires_human_review": false,
      "notes": "Checkpoint packs stay route-shaped until a bounded state_capsule export is needed."
    },
    {
      "runtime_surface": "approval_record",
      "runtime_refs": [
        "docs/MEMORY_MODEL.md#checkpoint-route-writeback"
      ],
      "target_kind": "decision",
      "writeback_class": "memo_surviving_event",
      "temperature_hint": "warm",
      "review_state_default": "confirmed",
      "requires_human_review": false,
      "notes": "Explicit approval outcomes survive as decisions rather than hidden state flags."
    },
    {
      "runtime_surface": "transition_record",
      "runtime_refs": [
        "repo:aoa-agents/schemas/artifact.transition_decision.schema.json",
        "repo:aoa-agents/docs/AGENT_RUNTIME_SEAM.md"
      ],
      "target_kind": "decision",
      "writeback_class": "memo_surviving_event",
      "temperature_hint": "warm",
      "review_state_default": "proposed",
      "requires_human_review": true,
      "notes": "Tier-transition records may survive as decisions when they shape restart, escalation, or handoff."
    },
    {
      "runtime_surface": "execution_trace",
      "runtime_refs": [
        "repo:aoa-agents/schemas/artifact.work_result.schema.json",
        "mechanics/recurrence-support/docs/WITNESS_TRACE_CONTRACT.md#writeback-mapping"
      ],
      "target_kind": "episode",
      "writeback_class": "memo_surviving_event",
      "temperature_hint": "warm",
      "review_state_default": "proposed",
      "requires_human_review": false,
      "notes": "Bounded execution traces become episodic memory rather than permanent scratchpad."
    },
    {
      "runtime_surface": "review_trace",
      "runtime_refs": [
        "repo:aoa-agents/schemas/artifact.verification_result.schema.json",
        "docs/AUDIT_EVENTS.md"
      ],
      "target_kind": "audit_event",
      "writeback_class": "memo_surviving_event",
      "temperature_hint": "cool",
      "review_state_default": "confirmed",
      "requires_human_review": false,
      "notes": "Meaningful review or lifecycle transitions become audit events when they affect recall posture."
    },
    {
      "runtime_surface": "distillation_claim_candidate",
      "runtime_refs": [
        "repo:aoa-agents/schemas/artifact.distillation_pack.schema.json",
        "mechanics/writeback/docs/WRITEBACK_TEMPERATURE_POLICY.md#bridge-ready-memory"
      ],
      "target_kind": "claim",
      "writeback_class": "reviewed_candidate",
      "temperature_hint": "cool",
      "review_state_default": "proposed",
      "requires_human_review": true,
      "notes": "Distilled claims remain candidates until review confirms provenance and temporal posture."
    },
    {
      "runtime_surface": "distillation_pattern_candidate",
      "runtime_refs": [
        "repo:aoa-agents/schemas/artifact.distillation_pack.schema.json",
        "docs/MEMORY_MODEL.md#procedural-experience-memory"
      ],
      "target_kind": "pattern",
      "writeback_class": "reviewed_candidate",
      "temperature_hint": "cool",
      "review_state_default": "proposed",
      "requires_human_review": true,
      "notes": "Distilled patterns remain observed regularities, not automatic technique canon."
    },
    {
      "runtime_surface": "distillation_bridge_candidate",
      "runtime_refs": [
        "repo:aoa-agents/schemas/artifact.distillation_pack.schema.json",
        "docs/MEMORY_MODEL.md#associative-memory"
      ],
      "target_kind": "bridge",
      "writeback_class": "reviewed_candidate",
      "temperature_hint": "cool",
      "review_state_default": "proposed",
      "requires_human_review": true,
      "notes": "Distilled bridges stay candidate links until review confirms that stronger source surfaces remain visible."
    }
  ]
}
